category,title,text,url,views,recommendation
건강,알고 먹자 영양제! ③ 비오틴은 정말 탈모에 효과가 있을까?,"‘비타민B7’ ‘비타민H’로도 불리는 비오틴(Biotin)은 모발과 피부, 손톱을 건강하게 유지하는 데 반드시 필요한 영양소다. 특히 머리카락을 구성하는 단백질인 케라틴 생성에 중요한 역할을 담당하고, 결핍 시 탈모가 나타날 수도 있기에 ‘모발 비타민’이라는 별명으로도 불린다고. 탈모로 고민하는 사람들 사이에서 특히 이름난 영양소인 비오틴. 비오틴의 역할과 효과 보는 섭취 팁을 소개한다.WHAT: 이름도 생소한 영양소 ‘비오틴’#탈모 보조제의 단골 영양소‘비오틴(Biotin)’이라는 단어를 가장 많이 목격하게 되는 곳은 아마도 탈모 샴푸나 탈모 보조제 패키지일 것이다. 비오틴은 맥주 효모의 주성분으로 모발이 강화된다고 광고하는 다양한 ‘맥주 효모’ 제품도 모두 비오틴 영양소 관련 제품이다. 그만큼 비오틴은 탈모에 효과가 있는 영양소로 잘 알려져 있다.비오틴은 비타민B 군의 종류 중 하나로 우리 몸의 3대 영양소인 탄수화물, 단백질, 지방의 대사 작용과 에너지 생성에 꼭 필요한 영양소다. 특히 모발이나 손발톱, 피부를 구성하는 케라틴 생성에 깊이 관여하기 때문에 비오틴이 부족해지면 모발이나 손발톱이 약해지는 것은 물론, 지루성 피부염이 생기기도 한다.#건강한 성인이라면 비오틴 결핍은 거의 없어성인의 비오틴 권장 필요량은 하루 30ug이다. 현대인의 일일 비오틴 섭취량은 평균 35~70ug이니 건강한 성인이라면 일반적인 식사를 통해 비오틴을 충분히 섭취할 수 있다. 단, ▲유전적으로 비오틴 대사 효소가 결핍된 경우 ▲날달걀 섭취가 많은 경우 ▲‘발프로익산(Valproic acid)’ 등 항경련제나 여드름 치료제 ‘이소트레티노인(Istretinoin)’을 복용하는 경우 ▲알코올중독 ▲항생제 장기 복용으로 장내 정상 세균총(Microbiome)이 망가진 경우 등 비오틴이 결핍된 사람은 비오틴 보충이 필요하다. 비오틴 결핍 여부는 증상이나 습관으로 쉽게 확인 가능하다.비오틴이 결핍되면 나타나는 증상&결핍을 유도하는 습관들□ 손발톱이 쉽게 부러지고, 찢어지고, 얇아진다□ 머릿결이 푸석해진다□ 탈모가 의심될 정도로 머리카락이 많이 빠진다□ 알코올중독 증상이 있다□ 날달걀을 자주, 많이 먹는다EFFECT: 머리카락을 굵어지게 한다고?#‘탈모’라고 다 효과 보는 건 아니에요비오틴이 모발을 건강하게 하는 영양소이고, 비오틴이 결핍되면 탈모가 발생하는 것, 모두 사실이다. 하지만 이때 반드시 알아야 할 것은 탈모에 무조건 비오틴이 효과가 있는 건 아니라는 것. 비오틴 영양제는 비오틴 결핍으로 인해 생긴 탈모에만 개선 효과가 있다. 만약 탈모가 비오틴 부족이 아닌, 유전적인 영향 등으로 생긴 증상이라면 아무리 비오틴 영양제를 먹어도 효과를 보기 어렵다.물론 비오틴을 비롯한 비타민 B, 비타민 A, 비타민 D, 비타민 E, 철분은 케라틴 합성을 도와 더 굵고 건강한 모발이 자라는 데 도움이 된다. 그러니 건강한 모발을 위해 이런 성분들이 부족하지 않도록 늘 신경쓸 것.#비오틴 결핍자라면? 탈모 치료제와 함께 드세요!만약 비오틴 결핍으로 인해 손톱이 약해지고, 탈모가 생긴 것이라면 비오틴 영양제 효과를 톡톡히 볼 수 있다. 물론 한두 번의 비오틴 영양제 복용만으로 해결할 수 있는 건 아니다. 최소 3개월 이상 꾸준히 꾸준히 복용하고, 탈모의 경우 전문 또는 일반의약품 탈모 치료제를 함께 사용하면 더 큰 효과를 누릴 수도 있다고 하니 참고할 것.콜라겐 효과를 높이는 ‘비오틴’건강기능식품으로 콜라겐을 고를 때 비오틴도 함유된 제품인지 확인 후 선택하자. 비오틴은 콜라겐 합성이 잘 되게 하는 영양소로 실제, 비오틴을 체내 투여한 쥐가 콜라겐 합성이 두 배 이상 잘 됐다는 실험 결과가 있다. 따라서 콜라겐 제품을 고를 때는 식약처에서 기능성을 인정받은 건강기능식품인지 여부와 함께 비오틴 함유 여부도 확인할 것을 권한다.HOW TO: 비오틴, 이렇게 보충하세요!#비오틴이 풍부한 음식은?비오틴은 체내에서 생성되지 않아 부족해지면 별도의 보충이 필요하다. 비오틴은 비타민B 복합체의 일종이라 계란과 호두, 오리고기, 콩, 견과류, 버섯 등에 풍부하게 들어있다. 단, 익히지 않은 달걀 흰자에는 장내 비오틴 흡수를 방해하는 아비딘(Avidin)이라는 단백질이 함유되어 있으니 달갈 섭취량이 많다면 노른자만 따로 익혀서 먹을 것.#영양제로 먹을 때는 식전에!비오틴은 소변으로 배출되는 수용성 비타민이다. 이에 식전 복용이 비오틴 흡수 측면에서 조금 더 유리하다. 하지만 평소 위장 장애가 있다면 식후 복용을 권한다.고함량 비오틴 영양제 섭취 시 심근경색 진단 검사인 트로포닌 테스트(troponin test)는 물론, 갑상선 기능 검사를 포함한 피검사 결과 수치에 오류를 발생시킬 수 있다. 이에 평소 비오틴 영양제를 복용하고 있다면 피검사 시 미리 비오틴 복용 여부를 말하는 것이 좋다.이런 사람은 피하세요!효모에는 핵산이 풍부한데, 핵산은 ‘통풍’이나 ‘고요산혈증’ 환자의 증상을 심화시킬 수 있으므로 해당 질환을 가진 사람이라면 의사와 상의 후 복용하거나 되도록 복용하지 않는 것이 좋다. 또 가스가 차거나 소화불량 증상이 있을 수 있으므로 만성 소화불량 환자나 ‘저산증’ 환자도 주의가 필요하다.알고 먹자 영양제②영양 과잉 시대, 칼슘 부족 사태! KB골든라이프X 연관 기사 보기KB골든라이프X 브리핑 No",https://www.kbgoldenlifex.com/senior/XAA72P05020.kb?bltsDstcd=01&bltsSerno=3123&ctntDstcd=01,154,http://kbgoldenlifex.com/senior/XAA72P05020.kb?bltsSerno=3080&bltsDstcd=01&ctntDstcd=01
건강,허옇게 일어난 각질이여 안녕~ 여름철 ‘발 미인’ 되는 법,"샌들의 계절, 시선이 머무는 곳은 단연 발뒤꿈치다. 피지선이 없어 다른 부위보다 건조하고, 각질이 쉽게 쌓이는 발! 붓고, 갈라지고, 각질까지 허옇게 일어난 발을 매끄럽게 하기 위한 팁을 알아보자.매끈한 발의 기본은 ‘발 씻기’매끈한 발을 유지하기 위한 기본 원칙은 발을 깨끗이 닦는 습관이다. 매일 저녁이면 발을 구석구석 깨끗하게 씻고, 피지선이 없어 각질이 쉽게 쌓이는 만큼 발 각질이 쌓이지 않게 주기적으로 제거하는 일 역시 잊으면 안 된다. 족욕과 마사지를 병행하면 한층 더 보드랍고 매끈한 발을 가질 수 있다고 하니 참고할 것.하나, 제대로 발 씻기발을 씻을 때는 살짝 차갑다 싶은 물로 발 구석구석을 깨끗이 씻는다. 발을 씻은 후에는 수건으로 발에 남은 물기를 남김없이 제거해야 습기로 인한 냄새 발생을 막을 수 있다. 헤어드라이어의 약한 바람으로 발에 남은 물기를 제거하는 것도 좋은 방법이다.둘, 주기적으로 족욕과 마사지하기혈액순환과 신진대사가 원활해지는 효과가 있는 족욕은 건조하고 푸석해진 발을 부드럽게 하는 효과도 있다. 대야에 발목 복사뼈가 푹 잠길 정도로 물을 채우고, 약 15분가량 발을 담그고 있으면 된다. 물 온도는 40℃ 정도의 미지근한 물로 시작, 3~5분이 지나 온도에 적응이 되면 미리 준비한 뜨거운 물을 조금씩 부어 물의 온도를 42~45℃까지 높이는 방법을 추천한다.자주 발이 붓는다면 발 마사지도 주기적으로 할 것. 발 마사지는 몸속에 정체된 노폐물을 몸 밖으로 빠르게 내보내 건강에 좋은 것은 물론이고, 예쁜 발 모양을 만들어주는 데도 효과적이다.발 전체에 보습크림을 넉넉히 바르고 허벅지 안쪽부터 종아리, 아킬레스건까지 꼼꼼하게 주무르되, 복사뼈 뒤에 쏙 들어간 부분과 아킬레스건 뒤는 특히 노폐물이 쌓이기 쉬운 부위니 특히 신경 써서 주물러 줄 것.셋, 마무리는 보습샤워나 족욕 후 얼굴에 보습을 해주듯 발을 씻고 난 뒤에도 크림을 발라줘야 한다. 풋 크림이나 보디 크림, 보디로션, 뭐든 좋다. 자꾸만 갈라지는 발이 고민이라면 풋 크림을 바른 다음, 수면 양말을 착용하고 잠자리에 드는 것도 좋은 방법이다.발뒤꿈치 각질, 한꺼번에 벗겨내면 안 돼요발뒤꿈치는 발 중에서도 특히 하중이 많이 실리고, 여름에는 대개 노출되어 있는 부위라 굳은살과 각질이 생기기 쉽다. 굳은살과 각질 제거 원칙은 여러 단계로 나눠 제거하는 것. 한 번에 무리해서 제거하면 필요한 각질까지 덩달아 제거해 걸을 때마다 통증을 느끼는 것은 물론, 각질이 더 두껍게 쌓일 수도 있다.# 굳은살 전용 면도기와 풋 파일로 굳은살과 각질을 없애요먼저 두껍고 딱딱해진 굳은살을 제거할 때는 자극이 적고 굳은살이 균일하게 벗겨지는 굳은살 전용 면도기를 사용한다. 보기 싫은 마음에 손으로 뜯거나 면도칼로 자르는 경우가 많은데 절대 안 된다.하얗게 일어난 각질은 발이 마른 상태에서 풋 파일로 부드럽게 갈아서 없앤다. 물에 불린 상태에서 풋 파일을 사용하면 잘 갈아지지도 않을뿐더러 지나치게 많은 각질을 없애 상처가 날 수 있다. 각질이 어느 정도 제거됐다 싶으면 발을 물에 불려 풋 스크럽제(각질제거제)로 가볍게 문질러 마무리한다. 혹은 스크럽제가 없다면 그냥 씻어만 내도 좋다. 각질 제거 후에는 크림을 듬뿍 바르고 부드럽게 마사지하면서 충분히 흡수시킨다.# 갈라진 뒤꿈치는 꼭 응급처치부터!각질이 많이 쌓이고, 건조한 상태가 오래 지속되면 발뒤꿈치가 트거나 쩍쩍 갈라질 수 있다. 이런 상태가 되면 보기 싫은 것은 둘째 치고, 그 사이로 세균 감염이 일어나거나 상처가 날 수 있어 응급처치가 꼭 필요하다.증상이 보이면 먼저 발을 깨끗하게 씻은 후 미지근한 물로 깨끗하게 헹군다. 이때 항균 효과가 있는 발 전용 세정제를 사용하면 더 좋다. 물기를 깨끗하게 닦은 후, 갈라진 부위의 세균 감염을 막고 재생을 돕는 연고를 바르고, 증상이 호전될 때까지는 양말을 신고 외출하는 등 외부 자극을 줄일 것을 권한다.복사뼈와 발등에도 관심을 가져야 해요대개 발 관리라 하면 발뒤꿈치나 발톱만을 생각한다. 하지만 관리하지 않은 복사뼈와 발등도 발을 지저분해 보이게 하는 요인 중 하나! 복사뼈도 각질이 쌓이면 회색으로 쉽게 변하고, 발등도 각질이 쌓이거나 햇빛을 많이 받으면 얼룩덜룩해지기 쉽다.이때는 샤워할 때 복사뼈와 발등에 알갱이가 든 스크럽제를 문질러 각질을 제거해 보자. 이 과정을 생략하더라도 크림에 오일을 섞어 마사지하듯이 문지르고, 양말을 신고 자면 피부가 한결 부드러워진다. 외출 전에 크림과 자외선 차단제를 섞어 발등과 복사뼈에 바르면 햇빛으로 인한 색 변화는 물론이고, 각질도 쉽게 생기지 않는다고 하니 참고하자",https://www.kbgoldenlifex.com/senior/XAA72P05020.kb?bltsDstcd=01&bltsSerno=3116&ctntDstcd=01,188,https://kbgoldenlifex.com/senior/XAA72P05020.kb?bltsSerno=3113&bltsDstcd=01&ctntDstcd=01
건강,"내 몸의 오랜 통증, 혹시 잘못된 자세 때문?","한 5분 걷거나 서 있었는데, 허리가 뻐근하고 저렸던 경험이 있는가? 갑자기 엉덩이뼈가 쑤시거나 하품할 때 턱이 아팠던 적은? 모두 잘못된 자세로부터 촉발된 질병의 증상들이다. 다리 꼬기, 턱 괴기 등 무심코 습관처럼 취하는 자세들이 일상생활을 어렵게 만드는 심각한 질병을 초래하기도 한다. 잘못된 자세로 인해 생길 수 있는 질병, 그리고 이를 예방할 수 있는 올바른 자세는 무엇일까?잘못된 자세 1. 지금, 다리 꼬고 있나요?자리에 앉으면 습관처럼 다리를 꼬는 사람은 ‘이상근증후군’이나 ‘좌골신경통’에 걸릴 가능성이 높다. 뒷주머니에 지갑을 넣고 앉는 것도 다리 꼬는 자세와 동일한 질병을 유발할 수 있으니 주의하자.허리 디스크 같은, 이상근증후군 & 전기가 오듯 찌릿, 좌골신경통이상근증후군은 이상근에 무리를 줘서 발생하는 질병으로 허리디스크와 비슷한 수준의 통증을 유발한다. 이상근은 엉덩이 뒤쪽에서 척추와 대퇴골에 걸쳐 분포하는 근육으로 엉덩이 관절을 회전시키는 역할을 한다.장시간 다리 꼬는 자세를 취하면 이상근 밑으로 지나가는 신경을 압박하며 통증을 일으키는데, 엉덩이 부위를 손으로 누를 때 통증이 느껴지며, 허리와 엉덩이가 뻐근하고, 때때로 다리 저린 증상이 동반되기도 한다. 허리 디스크와 유사하지만, 발가락에 힘이 빠지거나 반사 기능이 떨어지는 허리 디스크 증상은 나타나지 않는다고 하니 참고하자.좌골신경통은 좌골신경이 손상돼 염증이 생기면서 발생한다. 허벅지 바깥쪽이나 엉덩이로 이어진 후 종아리 바깥쪽과 뒤쪽까지 증상이 내려오는데, 아리거나 전기가 오듯 찌릿한 느낌이 특징이다. 배변할 때나 무거운 것을 들 때, 기침할 때 등 순간적으로 복부 압력이 강하게 오면 통증이 심해진다.√ 저릿저릿한 엉덩이와 허벅지, 스트레칭으로 풀기1. 바닥에 등을 대고 똑바로 누운 뒤, 한쪽 다리를 세워서 살짝 든다.2. 반대편 팔로 세운 무릎을 반대편으로 넘겨 무게를 더하듯 눌러준다. (10~15초간 유지)3. 이때, 시선은 무릎이 넘어간 반대편을 향하고, 어깨가 뜨지 않도록 주의한다.4. 반대편도 똑같이 반복한다.잘못된 자세 2. 쪼그려 앉기는 금물!쪼그려 앉아 일을 하면 무릎 등 하체로 몸무게의 약 9배에 달하는 하중이 전달된다. 그렇기에 장시간 같은 자세를 취할 경우 척추나 무릎에 압박을 줘 관절에 퇴행성 변화를 불러온다. ‘척추관협착증’이나 ‘무릎점액낭염’이 생기기 쉬우며, 보통 엉덩이뼈가 빠질 듯 아프거나 허벅지, 무릎 뒤, 종아리, 발목, 발바닥까지 저리고 쑤시는 증상이 나타난다.보통 걸레질, 손빨래 등 집안일을 할 때 이 자세를 자주 취한다. 그러므로 집안일을 하는 방법에도 변화가 필요한데, 손 걸레질 대신 막대 걸레를, 손빨래는 세면대에서 하는 등 의식적으로 쪼그려 앉는 자세를 피할 것.조금만 걸어도 허리가 뻐근한, 척추관협착증 & 무릎이 벌겋게, 무릎점액낭염척추관협착증은 신경이 지나는 통로인 척추관이 좁아지면서 신경을 압박하는 질병으로 허리와 다리가 저리고 심한 통증을 동반하기도 한다. 5분만 걷거나 서 있어도 허리가 뻐근하고 저린 증상이 심해져 자꾸만 주저앉게 된다. 허리를 구부리면 통증이 덜한 데 반해, 허리를 펼 때는 통증이 심해진다고 하니 증상을 체크해 보자.매일 스트레칭, 수영ㆍ자전거타기로 근력 강화하기√ ‘신경공 이완 스트레칭’은 척추와 무릎 질환에 효과적이다. 척추 사이 후관절을 열어 척추 주변 조직을 순환하게 하고, 좁아진 척추관을 늘려준다. 바닥에 등을 대고 누워 두 무릎을 세운 후 긴장을 푼다. 아랫배에 힘을 주고 무릎을 천천히 들어 올려 양손으로 무릎을 감싼다. 이후 숨을 내쉬며 무릎이 가슴에 닿을만큼 천천히 당긴다. 15초간 자세를 유지한 후 천천히 무릎을 내린다. 이를 총 3회 반복한다.√ 평소 운동으로 무릎 관절을 단련하면 더 좋다. 보통 이 부위 관절에 무리가 가지 않는 수영 혹은 자전거 타기 등이 도움 된다.잘못된 자세 3. 스마트폰 볼 때, 전방 머리 자세거북이처럼 머리를 길게 빼는 것과 그 모습이 비슷하다고 해 ‘거북목’ 자세라고도 한다. 전방 머리 자세는 의자에 앉아 컴퓨터 모니터 화면을 바라보거나 스마트폰을 오래 볼 때 흔히 하는 자세다.전방 머리 자세를 왼편에서 봤을 때 목뼈가 일자이거나 거꾸로 된 C자 형태인 경우가 많은데 이 자세는 여러 통증을 유발한다. 바른 자세는 몸의 왼편에서 봤을 때 C자 곡선임을 잊지 말자.# 목 통증과 두통이 동시에!목뼈가 일자가 되는 증상을 가리켜 ‘거북목증후군’이라고 한다. 목뼈 형태가 변형되면서 통증을 유발하는 질환으로, 변형된 목뼈가 머리 주변 근육을 긴장시키면서 두통을 일으키는 것이 특징이다. 만성적인 목 통증을 유발하기도 한다. 목을 뒤로 젖힐 때 아프거나 뻣뻣한 느낌이 들고, 어깨와 등이 굽거나 귀가 어깨보다 나와 있다면 거북목증후군일 가능성이 높다. 거북목증후군일 때 자세를 교정하지 않는다면 목 디스크로 발전할 수 있으니, 거북목증후군이 의심된다면 병원을 찾아 반드시 교정 치료를 받을 것.휴대폰 볼 때 자세는 이렇게!√ 컴퓨터나 휴대폰을 볼 때는 가슴을 천장으로 향하게 한다. 이 자세만으로 어깨가 자연히 펴지고 아래쪽 목뼈의 배열도 잡힌다. 두통이 있다면 턱을 안쪽으로 당기면서 동시에 허리를 곧게 펴는 자세를 취할 것. 이때 턱 끝이 목을 누른다는 느낌이 들어야 바른 자세다.√ 휴대폰을 볼 때는 목을 자연스럽게 세운 상태에서 턱을 살짝 당겨 시선을 아래로 10~15도 정도 살짝 아래로 볼 수 있게 높이를 조절한다. 중간중간 앉거나 선 자세에서 양쪽 등의 견갑골을 뒤로 지그시 당겨 어깻죽지가 뒤로 젖혀지게 하는 스트레칭도 필수다.잘못된 자세 4. 무심코 턱을 괴고 있다면?턱을 괴면 목에 가해지는 힘이 비대칭적으로 작용한다. 이런 자세가 지속되면 목 관절과 턱관절에 부담을 주는 건 물론, 얼굴 변형까지 일으킬 수 있다. 턱을 괴는 자세는 의식적으로 피하고, 턱 운동도 꾸준히 해줄 것.# 계속 턱을 괴면 위험해요, 턱관절 장애턱관절은 턱뼈와 머리뼈 사이에 위치해 두 뼈를 연결하는 관절이다. 턱관절은 모든 턱 운동의 중심축으로 말하기, 삼키기, 씹기 등 복합적인 활동을 담당하는데, 턱 괴는 자세는 이런 턱관절에 무리를 주기 때문에 ‘턱관절 장애’로 이어질 수 있다.음식을 씹거나 하품할 경우 양쪽 귀 옆의 아래턱뼈와 저작근육에 통증을 느끼는 것이 주요 증상. 입을 열 때마다 턱관절에서 딱딱거리는 관절 잡음이 들리기도 한다.# 얼굴형이 달라져요, 안면비대칭과 경추부염좌한쪽으로만 턱을 괴면 얼굴 균형이 무너지며 안면비대칭을 유발하고, 이와 함께 목뼈 모양이 변형되는 ‘경추부염좌’를 일으키기도 한다. 경추부염좌가 발병하면 목 주위에 통증이 생기고, 심한 경우 구토나 두통, 시력 장애, 이명 등 다양한 질환으로 이어질 수 있으니 주의한다.하루 6번, 매일 턱 운동√ 위와 같은 질병을 예방하기 위해 매일 턱 운동 습관을 들이면 좋다. 턱 운동은 혀를 위 앞니 안쪽에 가볍게 대고, 혀가 이에서 떨어지지 않을 정도까지 최대한 입을 벌려 6초 동안 유지하는 것이다. 하루 6회가량 실시해 보자",https://www.kbgoldenlifex.com/senior/XAA72P05020.kb?bltsDstcd=01&bltsSerno=3113&ctntDstcd=01,166,http://kbgoldenlifex.com/senior/XAA72P05020.kb?bltsSerno=3105&bltsDstcd=01&ctntDstcd=01
