category,title,text,url,views,recommendation
건강,건강관리가 즐거워진다! 헬시플레저,"<트렌드 코리아 2022>에서는 올해의 10대 트렌드 키워드 중 하나로 ‘헬시플레저’를 꼽았다. 건강(Healthy)과 기쁨(Pleasure)을 합한 말로 이제 건강도 쉽고 즐겁게 관리한다는 의미를 담고 있다.건강관리 패러다임이 달라지고 있다중장년 세대의 전유물?→ 전 세대의 관심사로!이전까지의 건강관리는 중장년층의 전유물처럼 여겨졌다. 하지만 코로나19로 인해 건강이 더욱 중요시되고, ‘건강은 건강할 때 지켜야 한다’, ‘체력 곳간에 인심 난다’ 등 건강이 곧 행복한 삶의 기본이라는 생각이 자리 잡으면서 남녀노소 불문 건강관리에 신경 쓰는 모습이다. 시장조사 전문 기업 트렌드 모니터에서 20대부터 60대까지를 대상으로 한 ‘2021 로우스펙 식음료 관련 조사’에 따르면 전체 응답자 중 78.8%가 ‘건강관리야말로 요즘 사람들의 자기 관리의 종착역이라 할 수 있다’고 답했다. 또한 40대 이상 되는 기성세대의 운동으로 분류되던 골프와 등산에 일명 골린이(골프+어린이), 등린이(등산+어린이)라 부르는 2030세대의 참여가 최근 부쩍 늘어난 데도 이 같은 배경이 자리한다.건강관리에 인내는 필수?→ 쉽고 즐겁고 지속적으로 관리한다!지금껏 건강관리는 곧 인내를 의미했다. 먹고 싶은 것을 참고, 운동하기 싫은 것을 참고, 건강관리를 이유로 친구 혹은 동료들과 어울리는 일을 자제했다. ‘다이어트는 내일부터’라는 우스갯소리에는 그 인내를 하루라도 미루고 싶은 은연한 마음이 담겨 있었다. 그러나 선조의 지혜가 담긴 ‘작심삼일’이란 사자성어에서 알 수 있듯 꾹꾹 눌러 참은 마음이 오래가지 못한다는 사실 또한 자명했다. 원푸드 다이어트, 간헐적 단식, 저탄고지 등 각종 건강관리 방법들이 유행처럼 번졌다가 지나간 이유다. 그런데 달라졌다. 포기와 후회, 다짐과 계획을 반복하던 사람들이 무작정 참기보다는 쉽고 즐겁게, 그리하여 오래도록 지속 가능한 건강관리를 계획한다. 한 달, 혹은 몇 개월 내에 목적을 달성하는 이벤트가 아닌, 밥을 먹고 잠을 자듯 당연하고도 자연스럽게 이뤄지는 일상 속 건강관리 습관을 목표로 한다.헬시플레저 트렌드 6#1칼로리는 낮추고,속세의 맛은 지키고최근 식음료 시장을 휩쓸고 있는 키워드 중 하나는 로우스펙(Low Spec)이다. 저칼로리, 저염, 저당 또는 무당, 무알코올 등 건강을 위해 가급적 피하거나 줄여야 하는 성분들의 함량을 대폭 낮춘 것이 특징이다. 이전에도 로우스펙 제품들은 몇몇 있었지만 맛있다는 평과는 거리가 멀었다. 어쩔 수 없이 먹자니 자괴감이 들고 안 먹자니 서운해서 대신 삼은 것이 제로콜라 같은 로우스펙 식음료였다. 요즘은 조금 다르다. 성분의 스펙은 낮추면서도 본연의 맛과 거의 가깝도록 유지해 먹는 즐거움도 놓치지 않았다. 밀가루 대신 곤약으로 만든 곤약 떡볶이, 밥 대신 달걀지단을 넣은 키토 김밥 등이 ‘속세의 맛’을 지켰다는 평가와 함께 인기를 끌었다. 트렌드 모니터의 앞선 조사에서도 로우스펙 식음료에 대한 관심의 이유로 ‘건강관리에 도움이 될 것 같아서’(78.1%), ‘많이 먹어도 심리적 부담이 덜할 것 같아서’(52.5%)라는 응답이 상위에 올랐다",https://www.kbgoldenlifex.com/senior/XAA72P05020.kb?bltsDstcd=01&bltsSerno=2644&ctntDstcd=01,432,https://www.kbgoldenlifex.com/senior/XAA72P05020.kb?bltsDstcd=01&bltsSerno=2598&ctntDstcd=01
건강,지금은 말린 나물을 꺼낼 때,"말려놓으면겨우내 두고두고먹기 좋은묵나물에 대해.정월대보름 음식,묵나물냉장고나 진공포장기 등 지금처럼 저장 및 보관 기술이 발달하지 않았던 과거에는 계절에 따라 나는 산나물과 들나물, 집에서 농사지은 채소 등을 말리는 것이 중요한 집안일 중 하나였다. 봄에는 고사리와 방풍나물, 여름에는 취나물과 곤드레나물, 수확의 계절인 가을에는 무와 호박, 고춧잎, 고구마 줄기 등 종류도 다양했다. 잘 말린 나물은 고이 묵혔다가 먹거리가 나지 않는 추운 겨울에 꺼내 무치거나 볶아서 먹었다. 이처럼 묵혔다 먹는다고 해서 묵나물 또는 묵은 나물이라 부르며, 한자로는 진채(陣菜), 요즘에는 건나물이라는 말도 많이 쓰인다. 묵나물은 정월대보름 시절식으로, 조선 후기 세시풍속서 <동국세시기>에는 “박나물, 버섯 등의 말린 것과 대두황권, 순무, 무 등을 묵혀둔다. 이것을 진채라 한다. 이것들을 반드시 이날 나물로 무쳐 먹는다. 대체로 외꼭지, 가지고지, 시래기 등도 모두 버리지 않고 말려두었다가 삶아서 먹는다. 이것들을 먹으면 더위를 먹지 않는다고 한다”는 기록이 남아 있다. 특히 다섯 가지 곡식으로 지은 오곡밥과 함께 묵나물 아홉 가지를 먹었는데, 한 자릿수 중 가장 큰 숫자인 ‘9’를 빌려 한 해의 풍년을 기원했다는 이야기가 속설 중 하나로 전해진다.저장 기간은 더 길게,영양소는 더 많이나물을 말리는 가장 큰 이유는 오랜 기간 저장하기 위해서다. 나물은 보관이 까다롭기로 유명하다. 자칫 방심하면 금세 무르거나 상하기 때문이다. 나물을 말리면 나물 속 수분이 날아가면서 효소 작용 및 미생물 번식을 억제해 두고두고 오래 먹을 수 있다. 또 말리는 과정에서 영양분이 농축돼 추운 겨울 몸속 열량을 높이는 데도 도움을 준다. 식이섬유를 비롯해 무기질, 미네랄 등 함량이 높아지며, 햇볕을 받아 생성된 비타민 D가 칼슘의 흡수를 도와 골다공증에도 좋다. 이렇듯 영양이 풍부한 묵나물은 비만 및 각종 성인병 예방은 물론 혈중 콜레스테롤을 낮추고 다이어트에도 효과가 있어 대표적인 건강식품이자 웰빙 식품으로 꼽힌다.몸에 좋은묵나물 9가지1. 고구마 줄기고구마 줄기에는 수용성 식이섬유가 많아 변비에 효과가 좋다. 블루라이트를 흡수해 눈의 황반을 보호하는 루테인, 항산화 물질인 베타카로틴과 안토시아닌 등도 함유돼 있다. 말린 고구마 줄기는 시간을 들여 불리고 삶아야 질기지 않다.2. 고사리영양소가 많아 ‘산에서 나는 소고기’라 불리는 고사리는 무기질 중 칼륨과 인이 풍부하다. 말린 고사리를 고를 때는 색이 너무 어둡지 않은지 살펴보고, 국산의 경우 줄기가 짧고 윗부분에 잎이 더 많으며 연한 갈색을 띠니 참고한다.3. 고춧잎고추 열매를 거두기 전 부드럽고 여린 고춧잎을 따서 말린다. 볶음과 무침은 기본, 장아찌로 담가 먹어도 맛있다. 비타민 함량은 풋고추의 약 70배에 달하며, 체지방 감소를 돕는 카테킨 함량 또한 녹차보다 약 12배나 많다.4. 곤드레식물성 단백질과 탄수화물 함량이 높은 곤드레는 보릿고개 시절 구황식물로 많이 먹었다. 베타카로틴 성분이 몸속 활성산소를 제거해 암을 예방하고 노화 방지에 도움을 주며, 소화가 잘돼 속이 편안하다.5. 무말랭이제철 무를 채 썰어 말린 것으로 꼬득꼬득 씹히는 식감이 일품이다. 고춧잎과 환상의 궁합을 자랑해 무침으로 많이 만든다. 말린 무는 생무에 비해 칼슘 함량이 10배 가까이 증가해 골다공증 위험이 높은 갱년기 또는 폐경기 여성에게 추천한다.6. 방풍나물이름 그대로 ‘풍’을 예방한다는 뜻의 방풍나물은 각종 효능이 뛰어나 과거에는 주로 약재로 쓰였다. 비타민 B군이 풍부해 감기에 좋으며, 미세먼지 또는 중금속의 배출 및 해독, 신경성 스트레스 완화, 염증 억제 등의 효능도 있다.7. 시래기무청을 말려 만드는 시래기는 생선 조림이나 찌개, 된장국 등 요리에 두루 쓰인다. 겨울철 보약이라 부를 만큼 영양소도 많다. 무청의 식이섬유는 위와 장에 포만감을 주어 비만을 예방하고, 변비와 동맥 경화에도 좋다.8. 취나물말리면 특유의 쌉싸래한 맛에 구수함이 더해지는 취나물은 각종 비타민과 무기질이 많이 들어 있다. 같은 양을 쟀을 때 비타민 A 함유량은 배추의 10배이며, 단백질을 비롯해 칼륨, 칼슘, 인, 철분 등이 포함된 알칼리성 식품이기도 하다.9. 호박고지애호박을 얇게 썰어 말린 것으로 호박오가리라고도 부른다. 부드럽게 씹히는 애호박과 달리 말리는 과정에서 수분이 빠져 더 달고 쫄깃한 맛을 느낄 수 있다. 기관지 점막 재생에 필요한 비타민 A, 감기 예방에 좋은 비타민 C가 풍부하다",https://www.kbgoldenlifex.com/senior/XAA72P05020.kb?bltsDstcd=01&bltsSerno=2641&ctntDstcd=01,143,https://www.kbgoldenlifex.com/senior/XAA72P05020.kb?bltsDstcd=01&bltsSerno=2598&ctntDstcd=01
건강,[새해 운동 #2] 자세 교정이 필요하다! 올바른 걷기 자세,"걷기 운동이 아무리 좋다고 해도자세가 바르지 않으면효과는커녕 오히려관절에 무리가 될 수 있다.지금 바로 걷는 자세를 확인해보자.올바른 걷기 방법바르게 걷기 위해서는 우선 척추를 곧게 세우는 연습이 필요하다. 종아리부터 엉덩이, 어깨, 머리까지 벽에 붙이고 선 뒤 발뒤꿈치 바깥쪽이 바닥에 먼저 닿고 엄지발가락과 검지발가락을 사용해 바닥을 밀어주는 식으로 훈련을 하는 것이 좋다. 걷기도 준비운동이 필요하다. 걷기 운동도 관절을 이용한 운동이라 맨손체조나 준비운동을 5~10분 정도 하여 체온을 적당히 올린 후 시작해야 골절이나 부상을 방지할 수 있다. 특히 중장년층은 준비운동이 필수. 스트레칭을 한다는 생각으로 허리, 무릎, 다리, 발목, 목, 어깨, 팔, 손 등의 순서로 한 동작당 15~30초 유지하면서 약간 땀이 날 정도로 한다.걷기 운동을 위해서 발을 11자로 유지하는 것이 중요한데 발을 5도에서 11도가량 약간 벌린 뒤, 발끝을 11자 형태로 유지하며 걷는다. 팔은 자연스럽게 L자나 V자가 되도록 흔들면서 걷고, 체중은 발뒤꿈치에서 발바닥 전체 그리고 엄지발가락 뿌리 순으로 체중을 실어 걷는다.신발로 확인하는 걸음걸이신발은 앞에서 1/3 지점까지 위로 잘 꺾을 수 있는 것을 선택해야 걸을 때 균형 있는 자세로 앞꿈치를 이용해서 발을 밀어낼 수 있다. 밑창은 2.5~5cm 사이로 체중에 대한 충격을 흡수할 수 있는 쿠션이 있는 것이 좋다. 신발 뒷굽이 닳은 정도를 보면 걸음걸이와 자세 습관을 알 수 있다. 뒷굽에서 바깥쪽이 많이 닳는다면 발을 바깥쪽으로 15도 이상 발려서 걷는 팔자걸음을 걷는다고 볼 수 있다. 반면 신발 밑창에서 뒷굽 안쪽이 많이 닳는다면 안짱다리로 걷는 습관이 있다고 볼 수 있다. 만약 한쪽은 바깥쪽, 다른 한쪽은 안쪽이 많이 닳는다면 골반이 변형되거나 척추가 휘어 몸이 불균형한 상태인 것을 의심해볼 수 있다. 팔자걸음 같은 경우는 발을 바깥쪽으로 돌리면서 정강이뼈와 고관절이 바깥쪽으로 벌어지게 되는데 이를 오랫동안 방치하면 골반이 뒤로 눕게 되고 허리에 체중을 싣게 되면서 요통의 원인이 된다. 자신의 신발 밑창으로 걸음걸이를 확인해 바른 걷기 자세를 완성해보자",https://www.kbgoldenlifex.com/senior/XAA72P05020.kb?bltsDstcd=01&bltsSerno=2634&ctntDstcd=01,1113,https://www.kbgoldenlifex.com/senior/XAA72P05020.kb?bltsDstcd=01&bltsSerno=2535&ctntDstcd=01
건강,"겨울철 식중독 유발자, 노로바이러스 예방법","추운 날씨에도 견디는 노로바이러스는 겨울철 식중독을 일으키는 주범이다. 영하 20℃에서도 생존력이 강하고, 소량의 바이러스에도 쉽게 감염될 정도로 전염성이 높은 노로바이러스 예방법을 숙지해 철벽 차단해보자.겨울철에노로바이러스가 많은 이유겨울에는 인체의 면역력이 약해진다. 추운 날씨에는 바이러스와 싸우는 단백질(인터페론) 생성 유전자가 힘을 잃는다는 것이 연구 결과로 증명되었다. 겨울철 건조한 공기는 콧속의 점액을 마르게 하기 때문에 바이러스를 걸러내는 능력이 떨어진다. 뿐만 아니라 밀폐된 실내에 머무르는 시간이 늘어 바이러스가 더 오래 생존하는 것 또한 바이러스의 전파력을 높인다. 식중독은 고온다습한 여름에 많이 발생하지만, 추운 겨울에도 조심해야 할 식중독이 바로 노로바이러스다. 노로바이러스는 추위에 강해 영하 20℃에서도 살아남는다. 최근 5년간 노로바이러스 식중독 발생 통계에 따르면 날씨가 추워지는 11월부터 3월까지 집중적으로 발생했다. 노로바이러스는 위장에 염증을 일으키는 바이러스로 주로 굴과 같은 어패류, 오염된 지하수 등을 통해 전염된다. 또한, 노로바이러스 감염자와의 직접 또는 간접 접촉을 통해서도 쉽게 전파될 수 있다. 감염자의 구토물, 손을 씻지 않고 만진 수도꼭지, 문고리 등을 다른 사람이 만진 후 오염된 손을 입에 대거나 음식물 섭취 시 전파가 가능하다. 때문에 식당, 학교, 요양원 등 사람들이 많이 모인 장소에서 많이 발생한다.노로바이러스의 증상과 치료노로바이러스는 보통 12~48시간의 잠복기를 거친 뒤 오심, 구토, 설사, 복통 등의 증상이 발생한다. 이러한 증상은 1~3일 지속되는데 일반적으로 증상 발생 후, 1~3일 뒤에는 호전된다. 그러나 5세 미만 어린이, 65세 이상 고령자, 면역 저하자 등의 고위험군은 심한 경우 탈수증상이 동반될 수 있어 각별한 주의가 필요하다. 아직 노로바이러스 감염증에 대한 특별한 치료제는 없고, 필요한 경우 적절한 수분을 섭취하도록 한다. 그러나 어린이, 고령자, 면역 저하자의 경우 탈수증세가 쉽게 나타날 수 있어 필요 시 정맥 수액 치료를 진행한다. 일반적으로 치료를 하지 않아도 호전되는 감염증이지만, 전파력이 강하기 때문에 가장 중요한 것은 철저하게 예방해 확산을 방지하는 것이다.노로바이러스를어떻게 막을 수 있을까?전문가들이 권장하는 노로바이러스 예방법은 손을 자주 씻고 얼굴을 만지지 말 것, 물을 자주 마시고 비타민이 풍부한 녹황색 잎채소 등으로 균형 잡힌 식사를 할 것, 건조할 땐 가습기를 사용하고 환기를 자주 할 것과 더불어 예방접종을 하는 것이다. 노로바이러스는 단 10개의 입자로도 감염시킬 수 있을 정도로 전염력도 매우 강하다. 만약 주변에 감염자가 있어 화장실 등의 공간을 불가피하게 함께 사용한다면 화장실 변기, 문 손잡이 등은 염소 소독제를 40배 희석(염소 농도 1000ppm)해 소독해야 감염을 예방할 수 있다.노로바이러스 예방법 6① 흐르는 물에 비누로 30초간 손 씻기 ② 채소, 과일은 깨끗이 세척·소독하기③ 어패류는 흐르는 물에 세척하고 85℃에서 1분 이상 가열 후 섭취④ 조리도구·시설은 세척·소독 철저, 주변 환경 청결하게 관리⑤ 식중독 증상이 있을 시 조리작업 즉시 중지⑥ 화장실 변기 뚜껑을 닫고 물 내는 것을 습관화하기바다의 우유, 굴이노로바이러스의 매개체?겨울이 제철인 굴은 영양 높고 맛이 좋지만, 노로바이러스 식중독의 매개가 될 수 있는 수산물로 알려져 있다. 노로바이러스는 열에 약하기 때문에 굴을 생식으로 섭취하기보다 굴국밥, 굴찜, 굴전 등으로 조리해 먹는 것이 안전하다. 껍질을 깐 굴 중 제품 포장에 ‘가열조리용’, ‘익혀 먹는’ 등의 표시가 있는 제품은 절대로 생굴로 먹어서는 안 된다. 반드시 중심 온도 85℃, 1분 이상 가열해 익혀 먹어야 하는 제품임을 유의해야 한다. 피로 회복에 좋은 타우린과 피부를 맑게 만드는 아연이 다량 함유된 굴은 충분히 익혀 안전하게 섭취하자.노로바이러스에 도움이 되는 음식바나나바나나는 칼륨이 풍부하게 함유되어 있어서 설사를 할 때 좋은 과일. 잦은 설사로 몸속에서 빠져나간 영양분을 바나나를 통해서 보충할 수 있다.사과사과에는 펙틴 성분이 풍부하게 들어 있어 장염에 큰 도움을 준다.양배추양배추는 위 점막을 보호하고 위궤양, 위염, 대장질환, 장염에 효과적이다. 양배추는 즙을 내서 마시면 소화 기능을 도와 소화기관과 염증, 궤양을 호전하는 데 도움을 준다.매실매실은 해독 작용이 뛰어나고 독성 물질을 분해해 장을 튼튼하게 하는 식품이다. 장의 염증을 예방하고 위장 장애 개선에도 효과가 있다.보리차보리차는 설사로 인한 탈수 현상에 큰 도움이 되고 장 운동에도 효과가 있으며, 설사를 멈추게 한다",https://www.kbgoldenlifex.com/senior/XAA72P05020.kb?bltsDstcd=01&bltsSerno=2633&ctntDstcd=01,153,https://www.kbgoldenlifex.com/senior/XAA72P05020.kb?bltsDstcd=01&bltsSerno=2619&ctntDstcd=01
건강,[새해 운동 #1] 걷기 백신으로 젊어지자!,"걷기는 일상생활 속에서 언제, 어디서나 실천할 수 있는 신체 활동으로 비용 부담과 부상 위험이 낮은 안전한 운동이다. 걷기 운동만으로도 다양한 만성질환을 예방할 수 있을 뿐만 아니라 뇌 건강을 증진해 기억력을 향상시켜 젊어질 수 있다. 이만한 효과라면 젊음을 유지하는 백신은 바로 걷기 운동이라 할 수 있다.걷기 운동으로 되찾는건강과 젊음걷기 운동은 대표적인 유산소운동이다. 걸을수록 허리 근육과 엉덩이 근육, 허벅지 근육을 제대로 사용하여 발달을 도모한다. 그로 인해 근육이 발달하고, 혈압과 혈당을 조절해 심장마비 위험을 37% 정도 예방하는 효과가 있다. 야외에서 걸으면 햇볕을 쬐면서 걷기 때문에 골다공증 예방에도 도움이 된다. 또한 여러 연구를 통해 걷기 운동이 뇌 해마를 발달시켜서 기억력 향상에도 도움이 된다는 것이 증명되었다. 뇌세포를 연결하고 지탱하는 뇌백질이 걷기 운동을 통해 증가되어 1년 이상 꾸준히 걷기 운동을 하면 인지능력이 높아지고 사고력, 의사 결정 및 계획 수립 능력 등이 개선된다.1만 보 이하로 걸어도 좋다걷기 운동을 실천하는 이들 중에서는 ‘1만 보’ 이상은 걸어야 건강에 좋다고 알고 있는 경우가 많다. 걷기는 저강도 운동에 속하는 만큼, 1만 보 이하는 건강 증진에 별다른 도움이 되지 않는다고 생각하는 것이다. 그러나 중장년 여성의 경우에는 1만 보보다 적게 걸어도 건강 전반에 긍정적인 영향을 끼친다. 굳이 1만 보를 걷지 않더라도 혈압과 혈당, 콜레스테롤 수치가 개선되고, 사고력과 기억력 등 인지능력이 향상되며 이에 따라 삶의 질도 높아진다.중장년층 건강을 위한특별한 걷기 운동 3① 노르딕워킹노르딕워킹은 스틱으로 땅을 밀어내듯 걷는 것이다. 양손에 쥔 스틱으로 체중이 분산돼 척추와 관절에 무리가 덜 간다. 신체 균형도 제대로 잡을 수 있다. 또한 스틱을 계속 사용해 상체 운동 효과까지 볼 수 있다. 노르딕워킹은 신체 근육의 90% 이상을 쓰기 때문에 체력을 기를 수 있고 척주기립근도 강화된다.② 뒤로 걷기뒤로 걷기는 평소 잘 사용하지 않던 근육을 쓰기 때문에 전신 근육을 골고루 발달시킨다. 넘어지지 않기 위해 균형을 잡다 보면 뇌신경 기능을 자극해 치매 예방에도 도움이 된다. 다리 근육이 굳어져 많이 걷기 힘든 사람이나 무릎 수술 환자, 인대에 부상이 있는 사람에게도 좋다. 특히 퇴행성 무릎 관절염 환자가 뒤로 걸으면 신체 앞부분에 쏠려 있는 인대근육, 다리근육 외에 근육이 균형 있게 발달하고 무릎에 무리를 주지 않아 다리 통증이 완화된다.③ 인터벌 걷기인터벌은 운동, 훈련 등에서 중간 휴식을 이르는 말이다. 왕복 달리기 등에 전력을 쏟은 후 잠시 쉬는 것을 반복하면 큰 효과를 볼 수 있다. 일정 시간(거리)을 빠르게 걷다가, 잠시 느리게 걷는 방식이다. 30초나 1분간 숨이 좀 찰 정도로 빨리 걷고, 3분간 천천히 걷는 것이다. 익숙해지면 빨리 걷기를 늘리고, 느리게 걷기를 줄인다. 2~3분 빠르게 걷다가 1~2분 천천히 걷는 것을 반복할 수 있다.TIP인터벌 걷기 운동 효과제대로 누리는 방법1단계 - 근력운동걷기 전 준비 단계로, 2주 실시한 뒤 인터벌 걷기 시작종아리 들어올리기 10회×4세트 /스쿼트 10회×4세트 / 플랭크 10초×4세트2단계-인터벌 걷기인터벌 걷기 24분으로 30분 걷기 3배의 효과를 볼 수 있다",https://www.kbgoldenlifex.com/senior/XAA72P05020.kb?bltsDstcd=01&bltsSerno=2629&ctntDstcd=01,9958,https://www.kbgoldenlifex.com/senior/XAA72P05020.kb?bltsDstcd=01&bltsSerno=2376&ctntDstcd=01
